{"schema_version":"1.0","id":"transit-slow-reader","seed":1713,"mode":"trace","protocol":"h1","client_population":"commuter-wifi","path":{"rtt_ms":60,"bandwidth_kbps":4000},"streams":[{"id":"route-impact","bytes":12288}],"fault":{"type":"slow_reader","reader_delay_ms":75},"limits":{"timeout_ms":5000,"max_connections":8,"max_bytes":131072},"expected_work":{"checksum":"transit-route-r17-v7"}}
