{"schema_version":"1.0","id":"transit-reordering","seed":1709,"mode":"simulate","protocol":"h3_quic","client_population":"regional-mobile","path":{"rtt_ms":60,"bandwidth_kbps":4000},"streams":[{"id":"impact","bytes":12288},{"id":"alerts","bytes":6144},{"id":"accessibility","bytes":4096}],"fault":{"type":"reordering","stream_id":"impact","packet_index":1,"reorder_ms":35},"limits":{"timeout_ms":5000,"max_connections":4,"max_bytes":131072},"expected_work":{"checksum":"transit-three-stream-v1"}}
