{"schema_version":"1.0","id":"transit-jitter","seed":1707,"mode":"simulate","protocol":"h2_tcp","client_population":"commuter-wifi","path":{"rtt_ms":60,"bandwidth_kbps":4000},"streams":[{"id":"impact","bytes":12288},{"id":"alerts","bytes":6144},{"id":"accessibility","bytes":4096}],"fault":{"type":"jitter","jitter_ms":25},"limits":{"timeout_ms":5000,"max_connections":4,"max_bytes":131072},"expected_work":{"checksum":"982943b2b1bbe2a6b57ed06b816719f8671b118f901464af926918e2be2125f1"}}
