{"schema_version":"1.0","id":"transit-pool-exhaustion","seed":1714,"mode":"simulate","protocol":"h2_tcp","client_population":"burst-mobile","path":{"rtt_ms":60,"bandwidth_kbps":4000},"streams":[{"id":"impact","bytes":12288},{"id":"alerts","bytes":6144},{"id":"accessibility","bytes":4096}],"fault":{"type":"pool_exhaustion","connections":7},"limits":{"timeout_ms":5000,"max_connections":4,"max_bytes":131072},"expected_work":{"checksum":"transit-three-stream-v1"}}
